{
  "schema_version": 1,
  "evidence_role": "pilot",
  "method": "precision_pilot_v1",
  "pilot_id": "pilot-example",
  "study_revision_id": "4f4a33c6-cc8e-4ac1-b145-18647a928e49",
  "family_id": "family-example",
  "snapshot_id": "af69d2ca-ff80-43aa-9800-67f6895be64d",
  "expected_comparisons": [
    {
      "tier": "core",
      "budget": 4,
      "alternative": "simulation_informed",
      "reference": "cvss",
      "outcome": "mission_impact"
    },
    {
      "tier": "edge",
      "budget": 6,
      "alternative": "heuristic",
      "reference": "cvss",
      "outcome": "mission_impact"
    }
  ],
  "candidate_grid": {
    "plan_count_candidates": [
      5,
      6
    ],
    "attacks_per_plan_candidates": [
      10,
      12
    ]
  },
  "pilot_sampling": {
    "outer_subsamples": 20,
    "seed": 700001
  },
  "precision": {
    "target_half_width": 0.2,
    "guard_quantile": 0.9,
    "confidence_level": 0.95,
    "bootstrap_replicates": 200
  },
  "selection": {
    "rule": "lowest_predicted_runtime"
  }
}
